{
  "$schema": "https://json-schema.org/draft/2020-12/schema",
  "$id": "https://github.com/martenhq/marten-registry/schema/marten.schema.json",
  "title": "A Marten's marten.json",
  "type": "object",
  "additionalProperties": false,
  "required": ["slug", "name", "version", "summary", "category", "for", "look", "voice", "needs", "examples"],
  "properties": {
    "$schema": { "type": "string" },
    "slug": { "type": "string", "pattern": "^[a-z0-9](?:[a-z0-9-]{0,38}[a-z0-9])?$" },
    "name": { "type": "string", "minLength": 1, "maxLength": 40 },
    "version": { "type": "string", "pattern": "^(0|[1-9]\\d*)\\.(0|[1-9]\\d*)\\.(0|[1-9]\\d*)$" },
    "summary": { "type": "string", "minLength": 10, "maxLength": 140 },
    "category": {
      "enum": ["travel", "money", "home", "events", "games", "social", "work", "developer", "business", "writing", "productivity", "health", "learning", "wellbeing", "mentors", "life"]
    },
    "for": { "type": "array", "minItems": 1, "uniqueItems": true, "items": { "enum": ["you", "group"] } },
    "look": {
      "enum": ["banker", "navigator", "chef", "engineer", "pilot", "host", "scholar", "coach", "chief", "musician", "gardener", "nightowl", "agent", "gent", "royal", "wizard", "pirate", "cowboy", "captain", "sailor", "builder", "robot", "hero", "champion", "artist", "romantic", "santa", "angel", "devil", "sprout", "plain"]
    },
    "voice": { "enum": ["sarah", "alice", "lily", "matilda", "laura", "river", "daniel", "brian", "charlie", "will"] },
    "needs": {
      "type": "object",
      "additionalProperties": false,
      "required": ["apps"],
      "properties": {
        "apps": { "type": "array", "items": { "$ref": "#/$defs/app" } },
        "optional": { "type": "array", "items": { "$ref": "#/$defs/app" } },
        "mcp": {
          "type": "array",
          "items": {
            "type": "object",
            "additionalProperties": false,
            "required": ["name", "why"],
            "properties": { "name": { "type": "string", "minLength": 1 }, "why": { "$ref": "#/$defs/why" } }
          }
        }
      }
    },
    "triggers": {
      "type": "array",
      "items": {
        "type": "object",
        "additionalProperties": false,
        "required": ["app", "type", "title", "instructions"],
        "properties": {
          "app": { "$ref": "#/$defs/appId" },
          "type": { "type": "string", "pattern": "^[A-Z0-9_]+$" },
          "title": { "type": "string", "minLength": 1, "maxLength": 60 },
          "config": { "type": "object" },
          "instructions": { "type": "string", "minLength": 10, "maxLength": 2000 }
        }
      }
    },
    "examples": { "type": "array", "minItems": 2, "maxItems": 5, "items": { "type": "string", "minLength": 2, "maxLength": 120 } }
  },
  "$defs": {
    "appId": { "enum": ["gmail", "googlecalendar", "linear", "github", "slack", "notion", "stripe", "vercel", "posthog", "ynab", "superset", "typefully"] },
    "why": { "type": "string", "minLength": 5, "maxLength": 120 },
    "app": {
      "type": "object",
      "additionalProperties": false,
      "required": ["app", "why"],
      "properties": { "app": { "$ref": "#/$defs/appId" }, "why": { "$ref": "#/$defs/why" } }
    }
  }
}
